{
  "name": "conjure",
  "version": "0.5.0",
  "description": "Production-grade Claude Code harness kit. Lazy-loaded skills, isolated subagents, deterministic hooks, knowledge-graph integration, multi-stack profiles, compliance overlays, safe migration from other AI tools.",
  "author": {
    "name": "mohandoz",
    "email": "33397039+mohandoz@users.noreply.github.com"
  },
  "license": "MIT",
  "repository": "https://github.com/mohandoz/conjure",
  "homepage": "https://github.com/mohandoz/conjure#readme",
  "keywords": [
    "claude-code",
    "harness",
    "skills",
    "hooks",
    "subagents",
    "knowledge-graph",
    "graphify",
    "lazy-loading",
    "scaffold",
    "migration"
  ],
  "skills": "./templates/skills",
  "agents": [
    "./templates/agents/code-explorer.md",
    "./templates/agents/test-writer.md",
    "./templates/agents/migration-writer.md",
    "./templates/agents/security-auditor.md",
    "./templates/agents/doc-writer.md",
    "./templates/agents/diff-reviewer.md"
  ]
}
